name,birthdate,birthplace,sex,status,region,province,city,brgy,code,number,email,fb,father,occupation1,mother,occupation2,siblings,income,application,lrn,school,gwa,college,degree,yesno
Sofia Reyes,8/14/04,Cebu City,Female,Single,REGION VII,CEBU,CEBU CITY,LAHUG,6000,09278894561,sofia.reyes14@email.com,Sofia Marie Reyes,Antonio M. Reyes,Marine Engineer,Carmela D. Reyes,University Professor,2,"1,500,000",Graduating Senior High,107845123456,Cebu City National Science High School,97,University of the Philippines - Los Baños,Bachelor of Science in Agriculture,Yes
Luis Antonio Cruz,11/23/03,Baguio General Hospital,Male,Single,CAR,BENGUET,BAGUIO CITY,SESSION ROAD,2600,9175682345,luis.cruz.art@email.com,Luis Cruz,Gregorio S. Cruz,Painter,Isabel A. Cruz,Tour Guide,1,"300,000",Senior/High School Graduate,101239876543,Baguio City National High School,93,University of the Philippines - Baguio,Bachelor of Arts in Communication,No
Janna T. Lim,3/7/05,Davao Doctors Hospital,Female,Single,REGION XI,DAVAO DEL SUR,DAVAO CITY,BUHANGIN,8000,9331247896,janna.lim07@email.com,Janna Lim,Thomas W. Lim,Accountant,Jenny T. Go,Pharmacist,3,"800,000",Graduating Senior High,112233445566,Ateneo de Davao University,96,De La Salle University - Manila,Bachelor of Science in Business Administration,Yes
Marco S. Dela Paz,5/19/04,Iloilo City,Male,Single,REGION VI,ILOILO,ILOILO CITY,MOLO,5000,9458887766,marco.delapaz@email.com,Marco Dela Paz,Santiago R. Dela Paz,Fisherman,Lourdes S. Dela Paz,Market Vendor,5,"180,000",Graduating Senior High,109988776655,Iloilo National High School,95,West Visayas State University,Bachelor of Science in Nursing,No
Angelica P. Santos,12/1/03,Makati Medical Center,Female,Single,NCR,MANILA,CITY OF MANILA,SAMPALOC,1008,09171234567,anji.santos@email.com,Angelica Santos,Rafael G. Santos,Software Developer,Patricia L. Santos,Graphic Designer,2,"1,200,000",Senior/High School Graduate,108765432109,Philippine Science High School - Main Campus,98,Ateneo de Manila University,Bachelor of Science in Data Science,Yes
